{
  "$schema": "./build.schema.json",
  "Solution": "RevitPlugins.slnx",
  "PluginName": "RevitMirroredElements",
  "PublishDirectory": "01.BIM.extension\\BIM.tab\\bin",
  "RevitVersions": [
    "Rv2022",
    "Rv2023",
    "Rv2024"
  ],
  "IconUrl": "https://icons8.com/icon/15046/invert-selection",
  "BundleName": "Проверка на зеркальность",
  "BundleType": "InvokeButton",
  "BundleOutput": "01.BIM.extension\\BIM.tab\\Проверки.panel"
}
