{
  "$schema": "./build.schema.json",
  "Solution": "RevitPlugins.slnx",
  "PluginName": "RevitParamsChecker",
  "PublishDirectory": "01.BIM.extension\\BIM.tab\\bin",
  "RevitVersions": [
    "Rv2022",
    "Rv2023",
    "Rv2024"
  ],
  "IconUrl": "https://icons8.com/icon/21964/true-false",
  "BundleName": "Проверка параметров",
  "BundleType": "InvokeButton",
  "BundleOutput": "01.BIM.extension\\BIM.tab\\Проверки.panel"
}
