{
  "$schema": "./build.schema.json",
  "Solution": "RevitPlugins.slnx",
  "PluginName": "RevitValueModifier",
  "PublishDirectory": "01.BIM.extension\\BIM.tab\\bin",
  "RevitVersions": [
    "Rv2022",
    "Rv2023",
    "Rv2024"
  ],
  "IconUrl": "https://icons8.com/icon/set/copy/windows",
  "BundleName": "Перенос параметров",
  "BundleType": "InvokeButton",
  "BundleOutput": "01.BIM.extension\\BIM.tab\\Данные.panel\\Перенос параметров.pulldown"
}
