{
  "$schema": "./build.schema.json",
  "Solution": "RevitPlugins.slnx",
  "PluginName": "RevitUnmodelingMep",
  "PublishDirectory": "04.OV-VK.extension\\ОВиВК.tab\\bin",
  "RevitVersions": [
    "Rv2022",
    "Rv2023",
    "Rv2024"
  ],
  "IconUrl": "https://icons8.com/icon/22177/add-tag",
  "BundleName": "Настройки немоделируемых",
  "BundleType": "InvokeButton",
  "BundleOutput": "04.OV-VK.extension\\ОВиВК.tab\\Спецификации.panel\\Дополнительные.stack\\Немоделируемые.pulldown"
}
