{
  "$schema": "./build.schema.json",
  "Solution": "RevitPlugins.sln",
  "PluginName": "RevitIsolateByParameter",
  "PublishDirectory": "01.BIM.extension\\BIM.tab\\bin",
  "IconUrl": "https://icons8.com/icon/41532/3d-glasses",
  "BundleName": "Изолировать по параметру",
  "BundleType": "InvokeButton",
  "BundleOutput": "01.BIM.extension\\BIM.tab\\СМР.panel\\СМР.pulldown"
}
