{
  "$schema": "./build.schema.json",
  "Solution": "RevitPlugins.sln",
  "PluginName": "RevitVolumeOfWork",
  "PublishDirectory": "02.AR.extension\\АР.tab\\bin",
  "IconUrl": "https://icons8.com/icon/40112/brick-wall",
  "BundleName": "ВОР кладка",
  "BundleType": "InvokeButton",
  "BundleOutput": "02.AR.extension\\АР.tab\\ВОР.panel"
}
