{
  "$schema": "./build.schema.json",
  "Solution": "RevitPlugins.sln",
  "PluginName": "RevitRsnManager",
  "PublishDirectory": "01.BIM.extension\\BIM.tab\\bin",
  "RevitVersions": [
    "Rv2022",
    "Rv2023",
    "Rv2024"
  ],
  "IconUrl": "https://icons8.com/icon/i426cfMKcE3l/edit-text-file",
  "BundleName": "RSN.ini менеджер",
  "BundleType": "InvokeButton",
  "BundleOutput": "01.BIM.extension\\BIM.tab\\Связи.panel"
}
