{
  "$schema": "./build.schema.json",
  "Solution": "RevitPlugins.slnx",
  "PluginName": "RevitPunchingRebar",
  "PublishDirectory": "03.KR.extension\\КР.tab\\bin",
  "RevitVersions": [
    "Rv2022",
    "Rv2023",
    "Rv2024"
  ],
  "IconUrl": "https://icons8.com/icon/17868/bridge",
  "BundleName": "Поперечное армирование",
  "BundleType": "InvokeButton",
  "BundleOutput": "03.KR.extension\\КР.tab\\Армирование.panel"
}
