{
  "$schema": "./build.schema.json",
  "Solution": "RevitPlugins.sln",
  "PluginName": "RevitDeclarations",
  "PublishDirectory": "02.AR.extension\\АР.tab\\bin",
  "RevitVersions": [
    "Rv2022",
    "Rv2023",
    "Rv2024"
  ],
  "IconUrl": "https://icons8.com/icon/14336/data-sheet",
  "BundleName": "Декларации",
  "BundleType": "InvokeButton",
  "BundleOutput": "02.AR.extension\\АР.tab\\Декларации.panel"
}
