{
  "$schema": "./build.schema.json",
  "Solution": "RevitPlugins.sln",
  "PluginName": "RevitArchitecturalDocumentation",
  "PublishDirectory": "02.AR.extension\\АР.tab\\bin",
  "IconUrl": "https://icons8.com/icon/14336/data-sheet",
  "BundleName": "Создать архитектурную документацию",
  "BundleType": "InvokeButton",
  "BundleOutput": "02.AR.extension\\АР.tab\\Прочее.panel\\Прочее.pulldown"
}
