{
  "$schema": "./build.schema.json",
  "Solution": "RevitPlugins.slnx",
  "PluginName": "RevitAxonometryViews",
  "PublishDirectory": "04.OV-VK.extension\\ОВиВК.tab\\bin",
  "RevitVersions": [
    "Rv2022",
    "Rv2023",
    "Rv2024"
  ],
  "IconUrl": "https://icons8.com/icon/8145/top-view",
  "BundleName": "Создать схемы",
  "BundleType": "InvokeButton",
  "BundleOutput": "04.OV-VK.extension\\ОВиВК.tab\\Виды.panel\\"
}
