{
  "$schema": "./build.schema.json",
  "Solution": "RevitPlugins.slnx",
  "PluginName": "RevitKrChecker",
  "PublishDirectory": "03.KR.extension\\КР.tab\\bin",
  "RevitVersions": [
    "Rv2022",
    "Rv2023",
    "Rv2024"
  ],
  "IconUrl": "https://icons8.com/icon/LunGMFAtVtVk/financial-growth-analysis",
  "BundleName": "Проверить модель",
  "BundleType": "InvokeButton",
  "BundleOutput": "03.KR.extension\\КР.tab\\ВОР.panel"
}
