{
  "$schema": "./build.schema.json",
  "Solution": "RevitPlugins.sln",
  "PluginName": "RevitFamilyParameterAdder",
  "PublishDirectory": "03.KR.extension\\КР.tab\\bin",
  "IconUrl": "https://icons8.com/icon/iyK9ZX69nYUU/insert-row",
  "BundleName": "Добавить параметры в семейство",
  "BundleType": "InvokeButton",
  "BundleOutput": "03.KR.extension\\КР.tab\\Параметры.panel"
}
